"journal_name","type","person","unified_name","role","degree","position","affiliation","person_reserved","role_unified","gender","country","city","affiliation_unified","expertise","expertise_multiple"
"общество: социология, психология, педагогика","Редакционная коллегия","Горобец Светлана Владимировна","горобец светлана владимировна"," ","Доктор культурологии, кандидат педагогических наук","профессор кафедры фортепиано, ученый секретарь ученого совета","Санкт-Петербургский государственный институт культуры","Горобец Светлана Владимировна___ +++Доктор культурологии, кандидат педагогических наук---профессор кафедры фортепиано, ученый секретарь ученого совета===Санкт-Петербургский государственный институт культуры*** ","regular","f","Россия","Санкт-Петербург","санкт-петербургский государственный институт культуры","культурология",1
"logos et praxis","Редакционная коллегия","Горина Татьяна Сергеевна","горина татьяна сергеевна","ответственный и технический секретарь","кандидат философских наук","доцент кафедры философии и теории права","Волгоградский государственный университет","Горина Татьяна Сергеевна___ответственный и технический секретарь+++кандидат философских наук---доцент кафедры философии и теории права===Волгоградский государственный университет***Волгоград","middle","f","Россия","Волгоград","волгоградский государственный университет","философия",0
"экономика. социология. право","РЕДАКЦИОННАЯ КОЛЛЕГИЯ","Горина Светлана Алексеевна","горина светлана алексеевна"," ","доктор экономических наук","профессор, генеральный директор ООО «Аудит и консультирование»"," ","Горина Светлана Алексеевна___ +++доктор экономических наук---профессор, генеральный директор ООО «Аудит и консультирование»=== ***Москва, Россия","regular","f","Россия","Москва",NA,"экономика",0
"крестьяноведение","РЕДАКЦИОННЫЙ СОВЕТ","Гордон А. В.","гордон а. в."," "," "," ","ИНИОН РАН","Гордон А. В.___ +++ --- ===ИНИОН РАН***Москва, Российская Федерация","regular","m","Россия","Москва","ИНИОН РАН","история",0
"общество: социология, психология, педагогика","Редакционная коллегия","Гордиенко Оксана Викторовна","гордиенко оксана викторовна"," ","Доктор педагогических наук","доцент кафедры методики преподавания русского языка Института филологии, директор Института развития цифрового образования","Московский педагогический государственный университет","Гордиенко Оксана Викторовна___ +++Доктор педагогических наук---доцент кафедры методики преподавания русского языка Института филологии, директор Института развития цифрового образования===Московский педагогический государственный университет*** ","regular","f","Россия","Москва","московский педагогический государственный университет","педагогика",0
"ученые записки крымского федерального университета имени в.и. вернадского. социология. педагогика. психология","РЕДАКЦИОННАЯ КОЛЛЕГИЯ","Горбунова Н. В.","горбунова н. в."," ","д-р пед. н.","проф.","ИППиИО ГПА КФУ им. В. И. Вернадского","Горбунова Н. В.___ +++д-р пед. н.---проф.===ИППиИО ГПА КФУ им. В. И. Вернадского***Ялта","regular","f","Россия","Ялта","крымский федеральный университет (ялта)","педагогика",0
"поиск: политика. обществоведение. искусство. социология. культура","РЕДКОЛЛЕГИЯ","Горбунов Александр Александрович","горбунов александр александрович","первый заместитель главного редактора","д.п.н.","профессор"," ","Горбунов Александр Александрович___первый заместитель главного редактора+++д.п.н.---профессор=== *** ","middle","m","Россия","Москва","российский университет транспорта","политология",0
"поиск: политика. обществоведение. искусство. социология. культура","ОБЩЕСТВЕННЫЙ РЕДАКЦИОННЫЙ СОВЕТ","Горбунов А. А.","горбунов александр александрович","сопредседатель совета","доктор политических наук","профессор, директор Академии базовой подготовки РУТ (МИИТ), член Российской Академии транспорта, почетный работник высшего профессионального образования Российской Федерации"," ","Горбунов А. А.___сопредседатель совета+++доктор политических наук---профессор, директор Академии базовой подготовки РУТ (МИИТ), член Российской Академии транспорта, почетный работник высшего профессионального образования Российской Федерации=== *** ","middle","m","Россия","Москва","российский университет транспорта","политология",0
"экономика. социология. право","РЕДАКЦИОННАЯ КОЛЛЕГИЯ","Горбачёв Александр Николаевич","горбачёв александр николаевич"," ","кандидат юридических наук","доцент кафедры государственно-правовых дисциплин БГУ"," ","Горбачёв Александр Николаевич___ +++кандидат юридических наук---доцент кафедры государственно-правовых дисциплин БГУ=== ***Брянск, Россия","regular","m","Россия","Брянск","брянский государственный университет","юриспруденция",0
"теория и практика общественного развития","РЕДАКЦИОННАЯ КОЛЛЕГИЯ","Горбань Владимир Сергеевич","горбань владимир сергеевич"," ","доктор юридических наук","главный научный сотрудник сектора философии права, истории и теории государства и права, руководитель междисциплинарного Центра философско-правовых исследований Института государства и права Российской академии наук","Институт государства и права Российской академии наук","Горбань Владимир Сергеевич___ +++доктор юридических наук---главный научный сотрудник сектора философии права, истории и теории государства и права, руководитель междисциплинарного Центра философско-правовых исследований Института государства и права Российской академии наук===Институт государства и права Российской академии наук*** ","regular","m","Россия","Москва","институт государства и права РАН","юриспруденция",0
"сибирский философский журнал","РЕДАКЦИОННАЯ КОЛЛЕГИЯ","Горан В. П.","горан в. п."," ","доктор философских наук","профессор, профессор каф. истории философии ИФП НГУ"," ","Горан В. П.___ +++доктор философских наук---профессор, профессор каф. истории философии ИФП НГУ=== *** ","regular","m","Россия","Новосибирск","новосибирский государственный университет","философия",0
"теория и практика общественного развития","РЕДАКЦИОННАЯ КОЛЛЕГИЯ","Гончаров Виталий Викторович","гончаров виталий викторович"," ","кандидат юридических наук","доцент, исполнительный директор Юридической консалтинговой корпорации «Ассоциация независимых правозащитников»"," ","Гончаров Виталий Викторович___ +++кандидат юридических наук---доцент, исполнительный директор Юридической консалтинговой корпорации «Ассоциация независимых правозащитников»=== *** ","regular","m","Россия","Краснодар",NA,"юриспруденция",1
"теория и практика общественного развития","РЕДАКЦИОННАЯ КОЛЛЕГИЯ","Гончаров Виталий Викторович","гончаров виталий викторович"," ","кандидат юридических наук","доцент, Исполнительный директор Юридической консалтинговой корпорации «Ассоциация независимых правозащитников»"," ","Гончаров Виталий Викторович___ +++кандидат юридических наук---доцент, Исполнительный директор Юридической консалтинговой корпорации «Ассоциация независимых правозащитников»=== *** ","regular","m","Россия","Краснодар",NA,"юриспруденция",1
"социодинамика","РЕДСОВЕТ","Гончаров Виталий Викторович","гончаров виталий викторович"," ","доктор философских наук","исполнительный директор","Юридическая консалтинговая корпорация «Ассоциация независимых правозащитников»","Гончаров Виталий Викторович___ +++доктор философских наук---исполнительный директор Юридической консалтинговой корпорации «Ассоциация независимых правозащитников»===Краснодар","regular","m","Россия","Краснодар",NA,"юриспруденция",1
"векторы благополучия: экономика и социум","РЕДКОЛЛЕГИЯ","Гончаренко Марк Васильевич","гончаренко марк васильевич"," ","д-р филос. наук","профессор, Отделение социально-гуманитарных наук, Школа базовой инженерной подготовки","Томский политехнический университет","Гончаренко Марк Васильевич___ +++д-р филос. наук---профессор, Отделение социально-гуманитарных наук, Школа базовой инженерной подготовки===Томский политехнический университет***Томск, Россия","regular","m","Россия","Томск","томский политехнический университет","философия",0
"уровень жизни населения регионов россии","РЕДАКЦИОННЫЙ СОВЕТ","Гонтмахер Евгений Шлёмович","гонтмахер евгений шлёмович"," ","доктор экономических наук","профессор","Национальный исследовательский университет Высшая школа экономики","Гонтмахер Евгений Шлёмович___ +++доктор экономических наук---профессор===Национальный исследовательский университет Высшая школа экономики***Россия","regular","m","Россия","Москва","высшая школа экономики (москва)","экономика",0
"социология медицины","Редакционная коллегия","Голухов Георгий Натанович","голухов георгий натанович"," ","доктор медицинских наук","профессор, член-корреспондент РАН, президент ГКБ № 31 ДЗМ","ГБУЗ города Москвы «Городская клиническая больница № 31 Департамента здравоохранения города Москвы","Голухов Георгий Натанович___ +++доктор медицинских наук---профессор, член-корреспондент РАН, президент ГКБ № 31 ДЗМ===ГБУЗ города Москвы «Городская клиническая больница № 31 Департамента здравоохранения города Москвы***Россия","regular","m","Россия","Москва",NA,"медицина",0
"siberian socium","Редакционная коллегия","Голуб Ольга Юрьевна","голуб ольга юрьевна"," ","д-р социол. наук","проф., Почетный работник высшего профессионального образования Российской Федерации","Саратовский национальный исследовательский государственный университет им. Н.Г. Чернышевского","Голуб Ольга Юрьевна___ +++д-р социол. наук---проф., Почетный работник высшего профессионального образования Российской Федерации===Саратовский национальный исследовательский государственный университет им. Н.Г. Чернышевского***Саратов, Россия","regular","f","Россия","Саратов","саратовский государственный университет","социология",0
"социальное пространство","РЕДСОВЕТ","Головчин Максим Александрович","головчин максим александрович"," ","Кандидат экономических наук"," Старший научный сотрудник","ФГБУН ВолНЦ РАН","Головчин Максим Александрович___ +++Кандидат экономических наук--- Старший научный сотрудник===ФГБУН ВолНЦ РАН***Вологда, Россия","regular","m","Россия","Вологда","вологодский научный центр РАН","экономика",0
"уровень жизни населения регионов россии","РЕДАКЦИОННЫЙ СОВЕТ","Головнин Михаил Юрьевич","головнин михаил юрьевич"," ","член-корреспондент РАН, доктор экономических наук","директор Института экономики РАН","Институт экономики РАН","Головнин Михаил Юрьевич___ +++член-корреспондент РАН, доктор экономических наук---директор Института экономики РАН===Институт экономики РАН***Россия","regular","m","Россия","Москва","институт экономики РАН","экономика",0
"сибирский философский журнал","РЕДАКЦИОННАЯ КОЛЛЕГИЯ"," Головко Н. В.","головко н. в.","заместитель главного редактора","доктор философских наук","доцент, профессор каф. онтологии, теории познания и методологии науки ИФП НГУ"," "," Головко Н. В.___заместитель главного редактора+++доктор философских наук---доцент, профессор каф. онтологии, теории познания и методологии науки ИФП НГУ=== *** ","middle","m","Россия","Новосибирск","новосибирский государственный университет","философия",0
"среднерусский вестник общественных наук","РЕДАКЦИОННАЯ КОЛЛЕГИЯ","Головина Татьяна Александровна","головина татьяна александровна"," ","доктор экономических наук","профессор кафедры, зав. кафедрой менеджмента и управления персоналом Среднерусского института управления – филиала Российской академии народного хозяйства и государственной службы при Президенте РФ, выпускающий редактор серии «Экономика и управление»"," ","Головина Татьяна Александровна___ +++доктор экономических наук---профессор кафедры, зав. кафедрой менеджмента и управления персоналом Среднерусского института управления – филиала Российской академии народного хозяйства и государственной службы при Президенте РФ, выпускающий редактор серии «Экономика и управление»=== ***Орёл, Россия","regular","f","Россия","Орел","российская академия народного хозяйства и государственной службы при президенте рф (орел)","экономика",0
"среднерусский вестник общественных наук","МЕЖДУНАРОДНЫЙ РЕДАКЦИОННЫЙ СОВЕТ","Головина Татьяна Александровна","головина татьяна александровна"," ","доктор экономических наук","профессор кафедры, выпускающий редактор серии «Экономика и управление», зав. кафедрой менеджмента и управления персоналом Среднерусского института управления – филиала Российской академии народного хозяйства и государственной службы при Президенте РФ"," ","Головина Татьяна Александровна___ +++доктор экономических наук---профессор кафедры, выпускающий редактор серии «Экономика и управление», зав. кафедрой менеджмента и управления персоналом Среднерусского института управления – филиала Российской академии народного хозяйства и государственной службы при Президенте РФ=== ***Орёл, Россия","regular","f","Россия","Орел","российская академия народного хозяйства и государственной службы при президенте рф (орел)","экономика",0
"конфликтология","EDITORIAL BOARD","Golovin Yuri","головин юрий алексеевич"," ","доктор политических наук","профессор, зав. кафедрой социально-политических теоий","Ярославский государственный университет им. П.Г. Демидова","Golovin Yuri___ +++доктор политических наук---профессор, зав. кафедрой социально-политических теоий===Ярославский государственный университет им. П.Г. Демидова***Россия","regular","m","Россия","Ярославль","ярославский государственный университет","политология",0
"социальные и гуманитарные знания","РЕДКОЛЛЕГИЯ","Головин Юрий Алексеевич","головин юрий алексеевич","Главный редактор","доктор политических наук","профессор","Ярославский государственный университет им. П. Г. Демидова","Головин Юрий Алексеевич___Главный редактор+++доктор политических наук---профессор===Ярославский государственный университет им. П. Г. Демидова***Россия","chief","m","Россия","Ярославль","ярославский государственный университет","политология",0
"общество: социология, психология, педагогика","Редакционная коллегия","Голиков Николай Алексеевич","голиков николай алексеевич"," ","Кандидат педагогических наук","доцент, профессор Российской академии естествознания, заслуженный работник науки и образования, почетный работник общего образования РФ, психолог-консультант социально-психологической службы Тюменского индустриального университета"," ","Голиков Николай Алексеевич___ +++Кандидат педагогических наук---доцент, профессор Российской академии естествознания, заслуженный работник науки и образования, почетный работник общего образования РФ, психолог-консультант социально-психологической службы Тюменского индустриального университета=== *** ","regular","m","Россия","Тюмень","тюменский индустриальный университет","педагогика",0
