"journal_name","type","person","unified_name","role","degree","position","affiliation","person_reserved","role_unified","gender","country","city","affiliation_unified","expertise","expertise_multiple"
"социодинамика","РЕДСОВЕТ","Семенов Владимир Анатольевич","семенов владимир анатольевич"," ","кандидат философских наук, доктор социологических наук","профессор факультета государственного и муниципального управления Северо-Западного института управления - филиала Российской академии народного хозяйства и государственной службы при Президенте РФ"," ","Семенов Владимир Анатольевич___ +++кандидат философских наук, доктор социологических наук---профессор факультета государственного и муниципального управления Северо-Западного института управления - филиала Российской академии народного хозяйства и государственной службы при Президенте РФ=== *** ","regular","m","Россия","Санкт-Петербург","российский государственный педагогический университет им. а.и. герцена","философия",1
"урбанистика","РЕДАКЦИОННЫЙ СОВЕТ","Семенов Владимир Анатольевич","семенов владимир анатольевич"," ","кандидат философских наук","доктор социологических наук, профессор факультета государственного и муниципального управления","Северо-Западного института управления - филиала Российской академии народного хозяйства и государственной службы при Президенте РФ","Семенов Владимир Анатольевич___ +++кандидат философских наук---доктор социологических наук, профессор факультета государственного и муниципального управления===Северо-Западного института управления - филиала Российской академии народного хозяйства и государственной службы при Президенте РФ*** ","regular","m","Россия","Санкт-Петербург","российский государственный педагогический университет им. а.и. герцена","философия",1
"вестник удмуртского университета. социология. политология. международные отношения","РЕДАКЦИОННЫЙ СОВЕТ","Семедов Семед Абакаевич","семедов семед абакаевич"," ","доктор филос. наук","профессор","РАНХиГС при Президенте РФ","Семедов Семед Абакаевич___ +++доктор филос. наук---профессор===РАНХиГС при Президенте РФ***Москва, Россия","regular","m","Россия","Москва","российская академия народного хозяйства и государственной службы при президенте рф (москва)","философия",0
"общество: социология, психология, педагогика","Редакционная коллегия","Селитреникова Татьяна Анатольевна","селитреникова татьяна анатольевна"," ","Доктор педагогических наук","доцент, профессор кафедры физиологии","Национальный государственный университет физической культуры, спорта и здоровья имени П.Ф. Лесгафта","Селитреникова Татьяна Анатольевна___ +++Доктор педагогических наук---доцент, профессор кафедры физиологии===Национальный государственный университет физической культуры, спорта и здоровья имени П.Ф. Лесгафта***Санкт-Петербург","regular","f","Россия","Санкт-Петербург","национальный государственный университет физической культуры, спорта и здоровья","педагогика",0
"наука. культура. общество","РЕДАКЦИОННАЯ КОЛЛЕГИЯ","Селиверстова Нина Анатольевна","селиверстова нина анатольевна"," ","доктор социологических наук","профессор","Московский гуманитарный университет","Селиверстова Нина Анатольевна___ +++доктор социологических наук---профессор===Московский гуманитарный университет***Москва, РоссияСингх Вирендра___ +++доктор философии---профессор===Аллахабадский университет***Аллахабад, Индия","regular","f","Россия","Москва","московский гуманитарный университет","социология",0
"наука. культура. общество","РЕДАКЦИОННАЯ КОЛЛЕГИЯ","Селезнёв Игорь Александрович","селезнёв игорь александрович"," ","кандидат социологических наук","доцент, ведущий научный сотрудник","ИСПИ ФНИСЦ РАН","Селезнёв Игорь Александрович___ +++кандидат социологических наук---доцент, ведущий научный сотрудник===ИСПИ ФНИСЦ РАН***Москва, Россия","regular","m","Россия","Москва","ИСПИ ФНИСЦ РАН","социология",0
"мониторинг общественного мнения: экономические и социальные перемены","РЕДАКЦИЯ","СЕДОВА НАТАЛЬЯ НИКОЛАЕВНА","седова наталья николаевна","Заместитель Главного редактора"," ","Помощник Гендиректора по науке ВЦИОМ","ВЦИОМ","СЕДОВА НАТАЛЬЯ НИКОЛАЕВНА___Заместитель Главного редактора+++ ---Помощник Гендиректора по науке ВЦИОМ--- === *** ","middle","f","Россия","Москва","всероссийский центр изучения общественного мнения","-",0
"социология города","РЕДАКЦИОННЫЙ СОВЕТ","Н. Н. Седова","седова н. н."," ","д-р филос. наук, д-р юрид. наук","проф.","ВолгГМУ","Н. Н. Седова___ +++д-р филос. наук, д-р юрид. наук---проф.===ВолгГМУ***Волгоград","regular","f","Россия","Волгоград","волгоградский государственный медицинский университет","философия",1
"ойкумена. регионоведческие исследования","Редакционная коллегия","Севастьянов Сергей Витальевич","севастьянов сергей витальевич"," ","доктор политических наук","доцент, профессор кафедры политологии и международных отношений","Национальный исследовательский университет «Высшая школа экономики» ","Севастьянов Сергей Витальевич___ +++доктор политических наук---доцент, профессор кафедры политологии и международных отношений===Национальный исследовательский университет «Высшая школа экономики» ***Санкт-Петербург","regular","m","Россия","Санкт-Петербург","высшая школа экономики (санкт-петербург)","политология",0
"управление устойчивым развитием","РЕДАКЦИОННАЯ КОЛЛЕГИЯ","Свирина А. А.","свирина а. а."," ","д-р экон. наук","проф.","КНИТУ-КАИ","Свирина А. А.___ +++д-р экон. наук---проф.===КНИТУ-КАИ***","regular","f","Россия","Казань","казанский национальный исследовательский технический университет","экономика",0
"сибирский философский журнал","РЕДАКЦИОННАЯ КОЛЛЕГИЯ","Свидерски Э. (Edward Swiderski) ","свидерски эдвард м."," "," ","профессор философии культуры и эстетики","Фрибурский университет","Свидерски Э. (Edward Swiderski) ___ +++ ---профессор философии культуры и эстетики===Фрибурский университет***Фрибур, Швейцария","regular","m","Швейцария","Фрибург","фрибурский университет",NA,NA
"социологический журнал","РЕДАКЦИОННАЯ КОЛЛЕГИЯ","Свидерски Эдвард М.","свидерски эдвард м."," ","профессор философии","почетный профессор","Университет Фрибурга","Свидерски Эдвард М.___ +++профессор философии---почетный профессор===Университет Фрибурга***Швейцария","regular","m","Швейцария","Фрибург","фрибурский университет",NA,NA
"социодинамика","РЕДСОВЕТ","Сафонов Андрей Леонидович","сафонов андрей леонидович"," ","доктор философских наук","доцент, директор института","«Государственное бюджетное образовательное учреждение высшего образования Московской области «Технологический университет»»","Сафонов Андрей Леонидович___ +++доктор философских наук---доцент, директор института===«Государственное бюджетное образовательное учреждение высшего образования Московской области «Технологический университет»»***Королев, Россия","regular","m","Россия","Королев","технологический университет (королёв)","философия",0
"коммуникология","РЕДАКЦИОННЫЙ СОВЕТ","САФОНОВ Александр Львович","сафонов александр львович","Председатель редакционного совета","доктор экономических наук","профессор, проректор по стратегии и работе с органами власти","Финансовый университет при Правительстве Российской Федерации","САФОНОВ Александр Львович___Председатель редакционного совета+++доктор экономических наук---профессор, проректор по стратегии и работе с органами власти===Финансовый университет при Правительстве Российской Федерации***Москва, Российская Федерация","chief","m","Россия","Москва","финансовый университет при правительстве рф","экономика",0
"управление устойчивым развитием","РЕДАКЦИОННАЯ КОЛЛЕГИЯ","Сафиуллин А. Р.","сафиуллин а. р."," ","д-р экон. наук","проф.","К(П)ФУ","Сафиуллин А. Р.___ +++д-р экон. наук---проф.===К(П)ФУ***","regular","m","Россия","Казань","казанский (приволжский) федеральный университет","экономика",0
"управление устойчивым развитием","РЕДАКЦИОННАЯ КОЛЛЕГИЯ","Сафин Р.С.","сафин р.с."," ","д-р пед. наук","проф.","КГАСУ","Сафин Р.С.___ +++д-р пед. наук---проф.===КГАСУ***","regular","m","Россия","Казань","казанский государственный архитектурно-строительный университет","педагогика",0
"вестник рггу. серия: философия. социология. искусствоведение","РЕДАКЦИОННАЯ КОЛЛЕГИЯ","Сасаки Масамичи","сасаки масамичи"," ","доктор социологических наук","профессор","Университет Чуо","Сасаки Масамичи___ +++доктор социологических наук---профессор===Университет Чуо***Токио, Япония","regular","m","Япония","Токио","университет чуо",NA,NA
"социологические исследования","Международный редакционный совет","САСАКИ М.","сасаки масамичи"," "," ","проф.","Ун-т Чуо","САСАКИ М.___ +++ ---проф.===Ун-т Чуо***Япония","regular","m","Япония","Токио","университет чуо",NA,NA
"известия высших учебных заведений. социология. экономика. политика","РЕДАКЦИОННАЯ КОЛЛЕГИЯ","Сартбекова Нуржан Коодоевна","сартбекова нуржан коодоевна"," ","д. пед. н.","доцент, зав. кафедрой философии, межкультурной коммуникации и психологии Международного университета инновационных технологий"," ","Сартбекова Нуржан Коодоевна___ +++д. пед. н.---доцент, зав. кафедрой философии, межкультурной коммуникации и психологии Международного университета инновационных технологий=== ***","regular","f","Россия","Сочи","международный университет инновационных технологий","педагогика",0
"женщина в российском обществе","РЕДАКЦИОННЫЙ СОВЕТ","Саралиева Зарэтхан Хаджи-Мурзаевна","саралиева зарэтхан хаджи-мурзаевна"," ","Доктор исторических наук","профессор кафедры общей социологии и социальной работы, Председатель Нижегородского отделения межрегиональной общественной организации «Академия гуманитарных наук»","Национальный исследовательский Нижегородский государственный университет им. Н. И. Лобачевского","Саралиева Зарэтхан Хаджи-Мурзаевна___ +++Доктор исторических наук---профессор кафедры общей социологии и социальной работы, Председатель Нижегородского отделения межрегиональной общественной организации «Академия гуманитарных наук»===Национальный исследовательский Нижегородский государственный университет им. Н. И. Лобачевского*** ","regular","f","Россия","Нижний Новгород","национальный исследовательский нижегородский государственный университет","история",0
"теория и практика общественного развития","РЕДАКЦИОННАЯ КОЛЛЕГИЯ","Сапфирова Аполлинария Александровна","сапфирова аполлинария александровна"," ","доктор юридических наук","доцент, заведующий кафедрой земельного, трудового и экологического права Кубанского государственного аграрного университета им. И.Т. Трубилина","Кубанский государственный аграрный университет им. И.Т. Трубилина","Сапфирова Аполлинария Александровна___ +++доктор юридических наук---доцент, заведующий кафедрой земельного, трудового и экологического права Кубанского государственного аграрного университета им. И.Т. Трубилина===Кубанский государственный аграрный университет им. И.Т. Трубилина***","regular","f","Россия","Краснодар","кубанский государственный аграрный университет","юриспруденция",0
"вестник пермского университета. философия. психология. социология","РЕДАКЦИОННАЯ КОЛЛЕГИЯ","Сапогова Елена Евгеньевна","сапогова елена евгеньевна"," ","докт. психол. наук","профессор, профессор кафедры психологии образования","Московский педагогический государственный университет","Сапогова Елена Евгеньевна___ +++докт. психол. наук---профессор, профессор кафедры психологии образования===Московский педагогический государственный университет***Москва","regular","f","Россия","Москва","московский педагогический государственный университет","психология",0
"урбанистика","РЕДАКЦИОННЫЙ СОВЕТ","Сапов Вадим Вениаминович","сапов вадим вениаминович"," ","доктор социологических наук","старший научный сотрудник отдела теории и истории социологии","Институт социологии Российской академии наук","Сапов Вадим Вениаминович___ +++доктор социологических наук---старший научный сотрудник отдела теории и истории социологии===Институт социологии Российской академии наук***Москва, Россия","regular","m","Россия","Москва","ИС ФНИСЦ РАН","социология",0
"экономические и социальные перемены: факты, тенденции, прогноз","РЕДКОЛЛЕГИЯ","Сапир Жак","сапир жак"," "," ","профессор Высшей школы социальных наук ","EHESS, Центр исследований индустриализации","Сапир Жак___ +++ ---профессор Высшей школы социальных наук ===EHESS","regular","m","Франция","Париж","высшая школа социальных наук",NA,NA
"вестник удмуртского университета. социология. политология. международные отношения","РЕДАКЦИОННЫЙ СОВЕТ","Санникова Ольга Владимировна","санникова ольга владимировна"," ","доктор социол. наук","доцент, профессор кафедры социологии Института истории и социологии Удмуртского государственного университета"," ","Санникова Ольга Владимировна___ +++доктор социол. наук---доцент, профессор кафедры социологии Института истории и социологии Удмуртского государственного университета=== ***Ижевск, Россия","regular","f","Россия","Ижевск","удмуртский государственный университет","социология",0
"общество: социология, психология, педагогика","Международная редакционная коллегия","Сандоян Эдвард Мартинович","сандоян эдвард мартинович"," ","Доктор экономических наук РФ и РА","профессор, директор Института экономики и бизнеса","Российско-Армянский (Славянский) университет","Сандоян Эдвард Мартинович___ +++Доктор экономических наук РФ и РА---профессор, директор Института экономики и бизнеса===Российско-Армянский (Славянский) университет***Республика Армения","regular","m","Армения","Ереван","российско-армянский (славянский) университет",NA,NA
"теория и практика общественного развития","РЕДАКЦИОННАЯ КОЛЛЕГИЯ","Сандоян Эдвард Мартинович","сандоян эдвард мартинович"," ","доктор экономических наук РФ и РА","профессор, директор Института экономики и бизнеса Российско-Армянского (Славянского) университета","Российско-Армянский (Славянский) университет","Сандоян Эдвард Мартинович___ +++доктор экономических наук РФ и РА---профессор, директор Института экономики и бизнеса Российско-Армянского (Славянского) университета===Российско-Армянский (Славянский) университет***Республика Армения","regular","m","Армения","Ереван","российско-армянский (славянский) университет",NA,NA
"вестник южно-российского государственного технического университета (нпи). серия: социально-экономические науки","РЕДАКЦИОННАЯ КОЛЛЕГИЯ","Самыгин Сергей Иванович","самыгин сергей иванович"," ","доктор социологических наук"," профессор кафедры управления персоналом и социологии","Ростовский государственный экономический университет (РИНХ)","Самыгин Сергей Иванович___ +++доктор социологических наук--- профессор кафедры управления персоналом и социологии===Ростовский государственный экономический университет (РИНХ)***Ростов-на-Дону, Россия","regular","m","Россия","Ростов-на-Дону","ростовский государственный экономический университет","социология",0
