"journal_name","type","person","unified_name","role","degree","position","affiliation","person_reserved","role_unified","gender","country","city","affiliation_unified","expertise","expertise_multiple"
"ойкумена. регионоведческие исследования","Редакционная коллегия","Литошенко Денис Александрович","литошенко денис александрович"," ","кандидат исторических наук","доцент кафедры истории, политологии и государственно-правовых дисциплин Морской академии Морского государственного университета имени адмирала Г.И. Невельского"," Морской государственный университет имени адмирала Г.И. Невельского","Литошенко Денис Александрович___ +++кандидат исторических наук---доцент кафедры истории, политологии и государственно-правовых дисциплин Морской академии Морского государственного университета имени адмирала Г.И. Невельского=== Морской государственный университет имени адмирала Г.И. Невельского***Владивосток","regular","m","Россия","Владивосток","морской государственный университет","история",0
"социодинамика","РЕДСОВЕТ","Лисенкова Анастасия Алексеевна","лисенкова анастасия алексеевна"," ","доктор культурологии","проректор по науке и цифровой трансформации","ФГБОУ ВО ""Пермский государственный институт культуры""","Лисенкова Анастасия Алексеевна___ +++доктор культурологии---проректор по науке и цифровой трансформации===ФГБОУ ВО ""Пермский государственный институт культуры""***Пермь, Россия","regular","f","Россия","Пермь","пермский государственный институт культуры","культурология",0
"дискурс","РЕДАКЦИОННАЯ КОЛЛЕГИЯ","Лисанюк Елена Николаевна","лисанюк елена николаевна"," ","д-р филос. наук","доцент кафедры логики Института философии Санкт-Петербургского государственного университета","Санкт-Петербургский государственный университет","Лисанюк Елена Николаевна___ +++д-р филос. наук---доцент кафедры логики Института философии Санкт-Петербургского государственного университета===Санкт-Петербургский государственный университет***Санкт-Петербург, Россия","regular","f","Россия","Санкт-Петербург","санкт-петербургский государственный университет","философия",0
"известия высших учебных заведений. поволжский регион. общественные науки","РЕДАКЦИОННАЯ КОЛЛЕГИЯ","Липинский Дмитрий Анатольевич","липинский дмитрий анатольевич"," ","доктор юридических наук","профессор кафедры теории и истории государства и права","Тольяттинский государственный университет","Липинский Дмитрий Анатольевич___ +++доктор юридических наук---профессор кафедры теории и истории государства и права===Тольяттинский государственный университет*** ","regular","m","Россия","Тольятти","тольяттинский государственный университет","юриспруденция",0
"теория и практика общественного развития","РЕДАКЦИОННАЯ КОЛЛЕГИЯ","Линецкий Александр Федорович","линецкий александр федорович"," ","доктор экономических наук","доцент"," ","Линецкий Александр Федорович___ +++доктор экономических наук---доцент=== ***Екатеринбург","regular","m","Россия","Екатеринбург",NA,"экономика",0
"крестьяноведение","РЕДАКЦИОННАЯ КОЛЛЕГИЯ","Линднер Петер","линднер петер"," "," "," ","Франкфуртский университет","Линднер Петер___ +++ --- ===Франкфуртский университет***Франкфурт, Германия","regular","m","Германия","Франкфурт","франкфуртский университет",NA,NA
"социология медицины","Редакционный совет","Линденбратен Александр Леонидович","линденбратен александр леонидович"," ","доктор медицинских наук","профессор, главный научный сотрудник","ФГБНУ «Национальный научно-исследовательский институт общественного здоровья имени Н.А. Семашко»","Линденбратен Александр Леонидович___ +++доктор медицинских наук---профессор, главный научный сотрудник===ФГБНУ «Национальный научно-исследовательский институт общественного здоровья имени Н.А. Семашко»***Россия","regular","m","Россия","Москва","национальный научно-исследовательский институт общественного здоровья имени н. а. семашко","медицина",0
"вестник рггу. серия: философия. социология. искусствоведение","РЕДАКЦИОННАЯ КОЛЛЕГИЯ","Лиманская Людмила Юрьевна","лиманская людмила юрьевна"," ","доктор искусствоведения","профессор","Российский государственный гуманитарный университет (РГГУ)","Лиманская Людмила Юрьевна___ +++доктор искусствоведения---профессор===Российский государственный гуманитарный университет (РГГУ)***Москва, Российская Федерация","regular","f","Россия","Москва","российский государственный гуманитарный университет","искусствоведение",0
"урбанистика","РЕДАКЦИОННЫЙ СОВЕТ","Ликефет Андрей Львович","ликефет андрей львович"," ","кандидат экономических наук","профессор, член попечительского совета Государственного университета по землеустройству, генеральный директор ОАО «Корпорация «Жилищная инициатива», почетный строитель РФ"," ","Ликефет Андрей Львович___ +++кандидат экономических наук---профессор, член попечительского совета Государственного университета по землеустройству, генеральный директор ОАО «Корпорация «Жилищная инициатива», почетный строитель РФ=== ***Москва, Россия","regular","m","Россия","Москва",NA,"экономика",0
"siberian socium","Редакционная коллегия","Лига Марина Борисовна","лига марина борисовна"," ","д-р социол. наук","проф., Почетный работник высшего профессионального образования РФ, декан Социологического факультета","Забайкальский государственный университет","Лига Марина Борисовна___ +++д-р социол. наук---проф., Почетный работник высшего профессионального образования РФ, декан Социологического факультета===Забайкальский государственный университет***Чита, Россия","regular","f","Россия","Чита","забайкальский государственный университет","социология",0
"среднерусский вестник общественных наук","МЕЖДУНАРОДНЫЙ РЕДАКЦИОННЫЙ СОВЕТ","Ливцов Виктор Анатольевич","ливцов виктор анатольевич"," ","доктор исторических наук","профессор, почетный работник высшего профессионального образования, зам. директора Среднерусского института управления – филиала","Российская академия народного хозяйства и государственной службы при Президенте РФ","Ливцов Виктор Анатольевич___ +++доктор исторических наук---профессор, почетный работник высшего профессионального образования, зам. директора Среднерусского института управления – филиала===Российская академия народного хозяйства и государственной службы при Президенте РФ***Орел, Россия","regular","m","Россия","Орел","российская академия народного хозяйства и государственной службы при президенте рф (орел)","история",0
"демографическое обозрение","МЕЖДУНАРОДНЫЙ РЕДАКЦИОННЫЙ СОВЕТ","Либанова Элла","либанова элла"," ","академик НАН Украины, д.э.н."," ","Институт демографии и социальных исследований имени М.В. Птухи НАН Украины","Либанова Элла___ +++академик НАН Украины, д.э.н.--- ===Институт демографии и социальных исследований имени М.В. Птухи НАН Украины***Украина","regular","f","Украина","Киев","институт демографии и социальных исследований имени м.в. птухи НАН украины",NA,NA
"социологическая наука и социальная практика","РЕДАКЦИОННАЯ КОЛЛЕГИЯ","ЛИ Пэйлин","ли пэйлин"," "," ","академик","Китайская академия общественных наук","ЛИ Пэйлин___ +++ ---академик===Китайская академия общественных наук***Китай","regular","m","КНР","Пекин","китайская академия общественных наук",NA,NA
"вестник удмуртского университета. социология. политология. международные отношения","РЕДАКЦИОННЫЙ СОВЕТ","Ли Мэнлун","ли мэнлун"," ","кандидат истор. наук","доцент, Институт международных и общественных отношений, ","Цзилиньский университет ","Ли Мэнлун___ +++кандидат истор. наук---доцент, Институт международных и общественных отношений, ===Цзилиньский университет ***Чанчунь, Китай","regular","m","КНР","Чанчунь","цзилиньский университет",NA,NA
"primo aspectu","РЕДАКЦИОННАЯ КОЛЛЕГИЯ","Леонтьева Елена Юрьевна","леонтьева елена юрьевна"," ","доктор философских наук","профессор","Волгоградский государственный технический университет","Леонтьева Елена Юрьевна___ +++доктор философских наук---профессор===Волгоградский государственный технический университет***Россия","regular","f","Россия","Волгоград","волгоградский государственный технический университет","философия",0
"общество: социология, психология, педагогика","Редакционная коллегия","Леонова Ирина Сергеевна","леонова ирина сергеевна"," ","Доктор социологических наук, PhD in Social Sciences (Университет Гранады, Испания)","профессор кафедры отраслевой и прикладной социологии факультета социальных наук, заместитель декана факультета социальных наук по международной деятельности","Национальный исследовательский Нижегородский государственный университет им. Н.И. Лобачевского","Леонова Ирина Сергеевна___ +++Доктор социологических наук, PhD in Social Sciences (Университет Гранады, Испания)---профессор кафедры отраслевой и прикладной социологии факультета социальных наук, заместитель декана факультета социальных наук по международной деятельности===Национальный исследовательский Нижегородский государственный университет им. Н.И. Лобачевского*** ","regular","f","Россия","Нижний Новгород","национальный исследовательский нижегородский государственный университет","социология",0
"теория и практика общественного развития","РЕДАКЦИОННАЯ КОЛЛЕГИЯ","Леонова Ирина Сергеевна","леонова ирина сергеевна"," ","доктор социологических наук","профессор кафедры отраслевой и прикладной социологии факультета социальных наук, заместитель декана факультета социальных наук по международной деятельности","Национальный исследовательский Нижегородский государственный университет им. Н.И. Лобачевского","Леонова Ирина Сергеевна___ +++доктор социологических наук---профессор кафедры отраслевой и прикладной социологии факультета социальных наук, заместитель декана факультета социальных наук по международной деятельности===Национальный исследовательский Нижегородский государственный университет им. Н.И. Лобачевского*** ","regular","f","Россия","Нижний Новгород","национальный исследовательский нижегородский государственный университет","социология",0
"социальное пространство","РЕДСОВЕТ","Леонидова Галина Валентиновна","леонидова галина валентиновна"," ","Кандидат экономических наук","Доцент, Ведущий научный сотрудник, заведующий Центром социально-демографических исследований отдела исследований уровня и образа жизни населения","ФГБУН ВолНЦ РАН","Леонидова Галина Валентиновна___ +++Кандидат экономических наук---Доцент, Ведущий научный сотрудник, заведующий Центром социально-демографических исследований отдела исследований уровня и образа жизни населения===ФГБУН ВолНЦ РАН***Вологда, Россия","regular","f","Россия","Вологда","вологодский научный центр РАН","экономика",0
"уровень жизни населения регионов россии","РЕДАКЦИОННАЯ КОЛЛЕГИЯ","Леонидова Галина Валентиновна","леонидова галина валентиновна"," ","кандидат экономических наук","доцент, ведущий научный сотрудник, заведующая Лабораторией исследования проблем развития трудового потенциала Вологодского научного центра РАН"," Вологодский научный центр РАН","Леонидова Галина Валентиновна___ +++кандидат экономических наук---доцент, ведущий научный сотрудник, заведующая Лабораторией исследования проблем развития трудового потенциала Вологодского научного центра РАН=== Вологодский научный центр РАН***Россия","regular","f","Россия","Вологда","вологодский научный центр РАН","экономика",0
"экономические и социальные перемены: факты, тенденции, прогноз","РЕДСОВЕТ","Леонидова Галина Валентиновна","леонидова галина валентиновна"," ","к. э. н.","доцент ","Вологодский научный центр РАН","Леонидова Галина Валентиновна___ +++к. э. н.---доцент ===Вологодский научный центр РАН***Вологда, Россия","regular","f","Россия","Вологда","вологодский научный центр РАН","экономика",0
"демографическое обозрение","МЕЖДУНАРОДНЫЙ РЕДАКЦИОННЫЙ СОВЕТ","Леон Дэвид","леон дэвид"," ","PhD"," ","Лондонская школа гигиены и тропической медицины","Леон Дэвид___ +++PhD--- ***Лондонская школа гигиены и тропической медицины***Великобритания","regular","m","Великобритания","Лондон","лондонская школа гигиены и тропической медицины",NA,NA
"уровень жизни населения регионов россии","РЕДАКЦИОННЫЙ СОВЕТ","Ленчук Елена Борисовна","ленчук елена борисовна"," ","доктор экономических наук","профессор, главный научный сотрудник, руководитель научного направления «Экономическая политика»","Институт экономики РАН","Ленчук Елена Борисовна___ +++доктор экономических наук---профессор, главный научный сотрудник, руководитель научного направления «Экономическая политика»===Институт экономики РАН***Россия","regular","f","Россия","Москва","институт экономики РАН","экономика",0
"экономические и социальные перемены: факты, тенденции, прогноз","РЕДСОВЕТ","Ленчук Елена Борисовна ","ленчук елена борисовна"," ","д. э. н.","проф. ","Институт экономики РАН","Ленчук Елена Борисовна ___ +++д. э. н.---проф. ===Институт экономики РАН***Москва, Россия","regular","f","Россия","Москва","институт экономики РАН","экономика",0
"крестьяноведение","РЕДАКЦИОННЫЙ СОВЕТ","Ленц С.","ленц с."," "," "," ","Институт социальной географии","Ленц С.___ +++ --- ===Институт социальной географии***Лейпциг, Германия","regular","m","Германия","Лейпциг","институт социальной географии",NA,NA
"ойкумена. регионоведческие исследования","Редакционная коллегия","Лексютина Яна Валерьевна","лексютина яна валерьевна"," ","доктор политических наук","профессор РАН, профессор кафедры американских исследований Санкт-Петербургского государственного университета"," Санкт-Петербургский государственный университет","Лексютина Яна Валерьевна___ +++доктор политических наук---профессор РАН, профессор кафедры американских исследований Санкт-Петербургского государственного университета=== Санкт-Петербургский государственный университет***Санкт-Петербург","regular","f","Россия","Санкт-Петербург","санкт-петербургский государственный университет","политология",0
"мир россии. социология. этнология","РЕДАКЦИОННЫЙ СОВЕТ","Лексин В. Н.","лексин в. н."," ","доктор экономических наук","профессор, главный научный сотрудник","Институт системного анализа (РАН)","Лексин В. Н.___ +++доктор экономических наук---профессор, главный научный сотрудник===Институт системного анализа (РАН)*** ","regular","m","Россия","Москва","институт системного анализа РАН","экономика",0
"власть и элиты","РЕДАКЦИОННЫЙ СОВЕТ","Ледяев В. Г.","ледяев в. г."," "," "," "," ","Ледяев В. Г.___ +++ --- === ***Москва, Россия","regular","m","Россия","Москва",NA,"философия",0
"теория и практика общественного развития","РЕДАКЦИОННАЯ КОЛЛЕГИЯ","Леденёва Марина Викторовна","леденёва марина викторовна"," ","доктор экономических наук","доцент, профессор кафедры менеджмента и маркетинга","Волгоградский филиал РЭУ им. Г.В. Плеханова","Леденёва Марина Викторовна___ +++доктор экономических наук---доцент, профессор кафедры менеджмента и маркетинга===Волгоградский филиал РЭУ им. Г.В. Плеханова*** ","regular","f","Россия","Волгоград","российский экономический университет им. г.в. Плеханова (волгоград)","экономика",0
